"funding","title"
"1203250","Ultraviolet Radiation in the Arctic: 2012-2015"
"0714078","Collaborative Research: The Impacts of Arctic Storms on Landfast Ice Variations"
"1215551","Early-concept grant for exploratory research (EAGER) proposal: Accessing the potential of clumped isotope thermometry to constrain temperatures in the Arctic during the Pliocene"
"1107885","Collaborative Research: Resolving centennial- to millennial-scale trends in glacier extent and lake sedimentation in the Brooks Range, Arctic Alaska"
"1107662","Collaborative Research: Resolving centennial- to millennial-scale trends in glacier extent and lake sedimentation in the Brooks Range, Arctic Alaska"
"1107106","Integrating Passive Acoustic Monitoring in long-term oceanographic observations of the Bering Strait"
"1108451","Development of the Autonomous Arctic Infrared Observer (AAIRO)"
"1042531","Collaborative Research: Science Coordination Office for Summit Station and the Greenland Traverse"
"0909349","River Plumes as Indicators for Greenland Ice Sheet Melt"
"0612391","NA"
"1023651","Collaborative Research: A pan-Arctic, storm-by-storm isotopic investigation of the influence of Arctic sea ice on precipitation - a crucial link in the coupled climate system"
"1022032","Collaborative Research: A pan-Arctic, storm-by-storm isotopic investigation of the influence of Arctic sea ice on precipitation - a crucial link in the coupled climate system"
"0842779","Science Plan and Workshop Support for Bering Strait Environmental Observations"
"0806451","COLLABORATIVE RESEARCH:   Spatial and Temporal Influences of thermokarst features on Surface Processes in Arctic Landscapes"
"0612452","Development of data products for the  University of Wisconsin High Spectral Resolution Lidar"
"1205152","Rapid Response Research: Accessing New Sea Ice in an Arctic Winter Polynya"
"0632201","IPY:  Observing the dynamics of the deepest waters in the Arctic Ocean"
"1331019","Doctoral Dissertation Improvement:   Influences on Nutritional Status among Alaska Native Older Adults of Anchorage, Alaska"
"0732944","Collaborative Research.  IPY:  The Polaris Project:  Rising Stars in the Arctic"
"0908724","Frost flowers in Arctic winter: Sea-to-air transport of microbes and viruses"
"1255228","CAREER: Microbial Allocation of Assimilated Carbon: Interactions between Temperature, Substrate Quality, and Microbial Physiology Determine Efficiency of Arctic Soil Carbon Cycling"
"1210728","Dissertation Research: Is organic matter chemistry or temperature a stronger driver of microbial community structure in permafrost soil?"
"1303864","High Resolution, Active Remote Sensing of Cloud Microphysics at Summit, Greenland with Polarized Raman Lidar"
"0909048","Collaborative research: Glacier seismicity and its relationship to basal movement"
"0710891","Collaborative Research: High-resolution studies of glacier dynamics at two major outlet glaciers in East Greenland"
"1204013","Collaborative Research:  Exploring the Dynamics of the Active Layer and Near-Surface Permafrost across the North Slope of Alaska"
"1107623","COLLABORATIVE RESEARCH: Observing and characterizing submesoscale dynamics in the Arctic Ocean"
"1107277","Collaborative Research: Observing and Characterizing Submesoscale Dynamics in the Arctic ocean"
"1003740","Collaborative Research: Unraveling the post-Pliocene Arctic Ocean transition to the icehouse climate"
"1003777","Collaborative research: Unraveling the post-Pliocene Arctic Ocean transition to the icehouse climate"
"1970165","NA"
"1893085","NA"
"2085785","NA"
"1546225","NA"
"1488415","NA"
"1469145","NA"
"2220675","NA"
"1859976","NA"
"1235161","NA"
"0633878","Collaborative Research:  A Modular Approach to Building an Arctic Observing System for the IPY and Beyond in the Switchyard Region of the Arctic Ocean"
"0633885","Collaborative Research:  A Modular Approach to Building an Arctic Observing System for the IPY and Beyond in the Switchyard Region of the Arctic Ocean"
"0633343","NA"
"0909523","Collaborative Research: Nonlinearities in the Arctic climate system during the Holocene"
"0908200","Collaborative research: Nonlinearities in the Arctic climate system during the Holocene"
"0909354","Collaborative Research: Nonlinearities in the Arctic climate system during the Holocene"
"0909362","Collaborative Research: Nonlinearities in the Arctic climate system during the Holocene"
"0909502","Re-visiting ""The Limnology of Tundra Ponds"": Re-sampling historic sites to track global change in Arctic aquatic ecosystems."
"0935336","EAGER: Developing a high-resolution late Holocene sediment record of rapid Arctic climate change from the Colville delta and adjacent Beaufort Sea inner shelf"
"1216385","Doctoral Dissertation Improvement Grant: Microblades, Bifaces, and the Chindadn Complex: Reinvestigating the Healy Lake Archaeological Record, Alaska"
"1204145","NA"
"0806776","Collaborative Research: Cold-season gas exchange of arctic plants - resolving winter carbon and water balances of Alaskan arctic tundra"
"0855748","Collaborative Research: An Ocean Observing System for the Bering Strait, the Pacific Gateway to the Arctic - an integral part of the Arctic Observing Network"
"0856786","Collaborative Research:  An Ocean Observing System for the Bering Strait, the Pacific Gateway to the Arctic -¬ an integral part of the Arctic Observing Network"
"1854545","NA"
"1565495","RUI: Development of Computational Methods and Applications to Molecules in Microsolvation Environments."
"1738925","Support US-based Students to Attend the BioImage Informatics Conference 2017 (BII 2017)"
"1929698","NA"
"1107381","Collaborative Research:  Linking belowground phenology and ecosystem function in a warming Arctic"
"1107343","Collaborative Research: Ice Core Studies Reconstructing Greenland Climate During the Eemian and Beyond"
"1203902","A multi-faceted evaluation of aerosol impacts on Arctic clouds"
"1023672","Collaborative Proposal:  Aerosol Concentrations, Sources and Transport Pathways within the Arctic Polar Dome during Recent Millennia"
"0856421","The Circumpolar Active Layer Monitoring Network--CALM III (2009-2014): Long-term Observations on the Climate-Active Layer-Permafrost System"
"0856868","NA"
"6595008","NA"
"3030577","NA"
"3612378","NA"
"5774849","NA"
"9649872","NA"
"3023587","NA"
"3553661","NA"
"6546312","NA"
"3238646","NA"
"1971361","NA"
"5280656","NA"
"6482702","NA"
"7402121","NA"
"1948990","NA"
"5043229","NA"
"2751908","NA"
"1844606","NA"
"7217819","NA"
"3120048","NA"
"6394396","NA"
"1011255","NA"
"1122478","Ultrasensitivity in the Absence of Allostery for Multisite Chemical Reaction Networks"
"1023331","Collaborative Research: Annual Observations of the Biological and Physical Marine Environment in the Chukchi and Nearshore Beaufort Seas near Barrow, AK"
"0909499","Collaborative Research: Greenland Ice Sheet Snow Accumulation Variability: Filling Knowledge and Data Voids"
"0903124","Collaborative Research:  P2C2--Ice Core Paleoclimate Records from Combatant Col, British Columbia, Canada"
"0902392","Collaborative Research:  P2C2--Ice Core Paleoclimate Records from Combatant Col, British Columbia, Canada"
"0902240","Collaborative Research:  P2C2--Ice Core Paleoclimate Records from Combatant Col, British Columbia, Canada"
"0902734","Collaborative Research:  P2C2--Ice Core Paleoclimate Records from Combatant Col, British Columbia, Canada"
"1107695","Studies of the Production of Molecular Halogens in Arctic Snowpacks and on Sea Ice Surfaces"
"0424589","Center for Remote Sensing of Ice Sheets (CReSIS)"
"1303730","NA"
"1022703","Strain-Induced Fabric Development in Ice under Hydrostatic Pressure"
"1107498","Understanding the Wave-Driven Circulation and Variability of the Polar Atmosphere through Coordinated Observation, Analysis, and Modeling"
"0528632","Comparison of Water Properties and Flows in the U.S. and Russian Channels of the Bering Strait - 2005 to 2006"
"1107398","Long-term measurements of nitrogen oxides at the GEOSummit station, Greenland"
"1140098","RAPID: Tracking Radioactive Fallout from the Fukushima Dai-ichi Disaster in Arctic Snow"
"1204005","Collaborative Research:  Arctic Sensitivity to Climate Perturbations and a Millenial Perspective on Current Warming Derived from Shrinking Ice Caps"
"1107725","Precision, Accuracy, and Aliasing of Sea Ice Thickness from Multiple Observing Platforms"
"0806506","Modeling patch-scale expansion of arctic shrubs"
"1416961","Collaborative Research:  Year-round autonomous sampling of methane in Arctic lakes"
"6781174","NA"
"1108425","Collaborative Research: Linking belowground phenology and ecosystem function in a warming Arctic"
"1219344","Collaborative Research:  Using Visual Methods to Engage Indigenous Youth and Community Members in Cross-Site, International Analysis:  A Methodological Study"
"1023561","Collaborative Research - Development and innovation of the Barrow Area Information Database (BAID): A cyberinfrastructure that supports arctic science, outreach and education."
"1083213","NA"
"1220593","NA"
"1577864","NA"
"1023582","Collaborative Research: Terrestrial Linkages to Microbial and Metazoan Communities in Coastal Ecosystems of the Beaufort Sea"
"1023465","Collaborative Research: Terrestrial Linkages to Microbial and Metazoan Communities in Coastal Ecosystems of the Beaufort Sea"
"1022979","Collaborative Research: Long-term carbon storage shifts in high-latitude peatlands with paleoclimate change: Linking peatland modeling with paleoecology and paleohydrology"
"1107981","Collaborative Research: Sensitivity of Circum-Arctic Peatland Carbon to Holocene Warm Climates and Climate Seasonality"
"0538427","Trace and Ultra-Trace Chemistry Measurements of the WAIS Divide Ice Core"
"0839093","Collaborative Research: Integrated High Resolution Chemical and Biological Measurements on the Deep WAIS Divide Core"
"0909541","Biomass Burning, Dust, Sea Salt, Volcanic & Pollution Aerosols in the Arctic during the Last 2 Millennia: High Resolution Aerosol Records from NEEM & an Aray of Archived Ice Cores"
"1417128","Collaborative Research:  Year-round autonomous sampling of methane in Arctic lakes"
"1417815","Collaborative Research:  Year-round autonomous sampling of methane in Arctic lakes"
"4339692","NA"
"1203418","Collaborative Research: In Situ Borehole Measurements To Partition The Velocity Of The Greenland Ice Sheet Into Ice Deformation And Basal Sliding Components"
"1203451","Collaborative Research: In Situ Borehole Measurements To Partition The Velocity Of The Greenland Ice Sheet Into Ice Deformation And Basal Sliding Components"
"0632139","IPY: Collaborative Research on Carbon, Water, and Energy Balance of the Arctic Landscape at Flagship Observatories and in a PanArctic Network"
"0909507","Collaborative Research: A biotic awakening: How do invertebrates, microbes, and plants determine soil organic matter responses to release from nutrient limitation in arctic tundra?"
"1637459","LTER: The Role of Biogeochemical and Community Openness in Governing Ecological Change in Arctic Ecosystems"
"1026843","Arctic LTER:   Climate Change and Changing Disturbance Regimes in Arctic Landscapes"
"0423385","The Arctic LTER Project: Regional Variation in Ecosystem Processes and Landscape Linkages"
"9810222","LTER: The Arctic LTER Project: The Future Characteristics of Arctic Communities, Ecosystems, and Landscapes"
"9211775","The Arctic LTER Project: Terrestrial and Freshwater Researchon Ecological Controls"
"8702328","NA"
"1351680","NA"
"1304879","Collaborative Research: Asynchrony in the timing of goose-vegetation interactions: implications for biogeochemical cycling in wet sedge tundra"
"1304523","Collaborative Research:   Asynchrony in the timing of goose-vegetation interactions:   implications for biogeochemical cycling in wet sedge tundra"
"1418268","Doctoral Dissertation Research:  The Economic and Socialcultural Effects of Developing Cyber-Infrastructure for Global information Storage in Iceland"
"0909330","Controls on Sea Surface pCO2 Variability and CO2 Uptake in the Western Arctic Ocean"
"1304337","A better understanding of recent changes of the CO2 system in the Western Arctic Ocean via field measurements from the summer 2014 CHINARE cruise"
"2281472","NA"
"1204070","Collaborative Research: Interactions Between Air Temperature, Permafrost and Hydrology in the High Latitudes of Eurasia"
"9255000","Young Scholars Project -- Environmental and Earth Sciences"
"9452663","Young Scholars Project in Interdisciplinary Environmental   and Earth Sciences"
"9252348","Geophysical Instrumentation for Undergraduate Training in   Field Science on the Juneau Icefield, Alaska"
"0856845","Continued Core Atmospheric and Snow Measurements at the Summit, Greenland Environmental Observatory"
"0968391","PIRE: International Collaboration and Education in Ice Core Science (ICE-ICS)"
"1023318","Collaborative Research: Analysis of McCall Glacier Ice Core and Related Modern Process Studies"
"0538416","Collaborative Research: Norwegian-United States IPY Scientific Traverse: Climate Variability and Glaciology in East Antarctica"
"1204176","Collaborative Research: Continuous Records of Greenhouse Gases and Aerosol Deposition During the Holocene: Testing the Fidelity of New Methods for Reconstructing Atmospheric Change"
"1417787","Collaborative Research: Petermann Gletscher, Greenland - Paleoceanography and Paleoclimatology"
"1224181","Examining the intersections of place-making and development in the Pribilof Islands, Alaska"
"1523191","Doctoral Dissertation Research: Mapping Community Exposure to Coastal Climate Hazards in the Arctic: A Case Study in Alaska's North Slope"
"1108571","Education and Community Viability in Western Alaska"
"1550260","Partial Support for the Eleventh Conference on Hunting and Gathering Societies"
"1303879","Collaborative Reasearch:  Integrated Characterization of Energy, Clouds, Atmospheric structure, and Precipitation at Summit (ICECAPS)"
"0856559","Collaborative Research:  An Integrated Characterization of Energy, Clouds,   Atmospheric State, and Precipitation at Summit (ICECAPS)"
"1561437","The Carbon Balance of Arctic River Deltas: Tundra Fire as an Agent of System Change"
"1624927","Polaris: Catalyzing Demographic Change in the Arctic Research Community through an Immersive and Sustained Undergraduate Research Experience"
"1445811","Making Science Accessible to Inuit, Inughuit, and Iñupiat Arctic Indigenous Communities in Their Own Languages"
"1445823","High-Performance & Distributed Computing for Polar Sciences: Workshop on Applications, Cyberinfrastructure Requirements and Opportunities"
"1782189","NA"
"1304899","Collaborative Research:   Dynamics of subglacial erosion of soft sediments and its consequences for glacier evolution"
"1203779","Collaborative Research: Investigating the potential of carbon-14 in polar firn and ice as a tracer of past cosmic ray flux and an absolute dating tool"
"1203686","Collaborative Research: Investigating the potential of carbon-14 in polar firn and ice as a tracer of past cosmic ray flux and an absolute dating tool"
"1204084","Collaborative Research: Investigating the potential of carbon-14 in polar firn and ice as a tracer of past cosmic ray flux and an absolute dating tool"
"0611995","Factors controlling seasonal changes in the structure and function of food webs of perennial spring streams in Arctic Alaska"
"0902126","Collaborative proposal: Shifting seasonality of Arctic river hydrology alters key biotic linkages among aquatic systems"
"0902153","Collaborative Research: Shifting seasonality of Arctic river hydrology alters key biotic linkages among aquatic systems"
"0902106","COLLABORATIVE RESEARCH: How does changing seasonality affect the capacity of arctic stream networks to influence nutrient fluxes from the landscape to the ocean?"
"0902029","Collaborative Research: How does changing seasonality affect the capacity of arctic stream networks to influence nutrient fluxes from the landscape to the ocean?"
"0902113","Collaborative Research: How Does Changing Seasonality Affect the Capacity of Arctic Stream Networks to Influence Nutrient Fluxes from the Landscape to the Ocean?"
"1023537","Late Quaternary Sea Ice History of the Beringian Arctic Gateway"
"1304270","Collaborative Research:  Atmospheric measurements of O2/N2 ratio, CO2 concentration, and CO2 isotopes in support of the Arctic Observing Network"
"1304271","AON:  Development of Sustainable Observations of Thermal State of Permafrost in North America and Russia: The U.S. Contribution to the Global Terrestrial Network for Permafrost"
"1017920","NA"
"1303991","Doctoral Dissertation Research:   ""The sea is our garden"": Inupiaq subsistence, indigenous knowledge, and the 'politics of nature' in the context of Arctic offshore development"
"1304905","Collaborative research:  What role do glaciers play in terrestrial sub-arctic hydrology?"
"8048307","NA"
"5237777","NA"
"1417772","Colonization and Christianity:  the development of Viking Age and medieval hierarchies in Skagafjordur, North Iceland"
"1523025","Doctoral Dissertation Improvement Grant: The Archaeological Investigation of Erosion and its Effect on Social Processes in the Arctic"
"1432982","Arctic Observing Networks: Collaborative Research: Sustaining and amplifying the ITEX AON through automation and increased interdisciplinarity of observations"
"2919918","NA"
"1504381","Arctic Observing Networks: Collaborative Research: ITEX AON - understanding the relationships between vegetation change, plant phenology, and ecosystem function in a warming Arctic"
"2414016","NA"
"4083632","NA"
"1432277","Arctic Observing Networks: Collaborative Research: Sustaining and amplifying the ITEX AON through automation and increased interdisciplinarity of observations"
"1504141","Arctic Observing Networks: Collaborative Research: ITEX AON - understanding the relationships between vegetation change, plant phenology, and ecosystem function in a warming Arctic"
"0632187","Collaborative Research:  IPY:  Cloud Properties Across the Arctic Basin from Surface and Satellite Measurements - An Existing Arctic Observing Network"
"1107491","The role of tributaries in glacier surges"
"1107737","Phase One data rescue of the Austin Post air photo collection and new repeat aerial photography of Alaskan valley glaciers"
"0909454","Collaborative Research: Subglacial Controls on Greenland Ice Sheet Marginal Acceleration"
"0908156","Collaborative Research: Subglacial controls on Greenland Ice Sheet marginal acceleration"
"1348450","An open source framework for metadata exploration and discovery of Polar Data"
"1417700","Collaborative Research:  Vegetation And Ecosystem Impacts On Permafrost Vulnerability"
"1417745","Collaborative Research:  Vegetation And Ecosystem Impacts On Permafrost Vulnerability"
"1417908","Collaborative Research:  Vegetation And Ecosystem Impacts On Permafrost Vulnerability"
"0856531","AON:  Continuing the Beaufort Gyre Observing System to Document and Enhance Understanding Environmental Change in the Arctic"
"2769875","NA"
"1088372","NA"
"1005240","REU Site: Center for Scalable and Integrated Nanomanufacturing (SINAM) Nanomanufacturing Summer Academy (NMSA)"
"1503672","Coordination, Data Management and Enhancement of the International Arctic Buoy Programme"
"0520287","Coordination, Data Management and Enhancement of the IABP"
"0856292","Coordination, Data Management and Enhancement of the International Arctic Buoy Programme"
"1204267","Circulation and Respiration in Ice-covered Arctic Lakes"
"1304755","Oceanographic and Biological Implications of Arctic Sea-Ice Change:  Evidence from Quaternary Benthic Foraminifers"
"1646262","NA"
"1303766","Collaborative Research:   Assessing the Impact of Small, Canadian Arctic River Flows (SCARFs) to the Freshwater Budget of the Canadian Archipelago"
"1023118","Collaborative Research: The O-Buoy Network of Chemical Sensors in the Arctic Ocean"
"1023393","Collaborative Research: The O-Buoy Network of Chemical Sensors in the Arctic Ocean"
"1022834","Collaborative Research:  The O-Buoy Network of Chemical Sensors in the Arctic Ocean"
"1022773","Collaborative Research: The O-Buoy Network of Chemical Sensors in the Arctic Ocean"
"1848681","NA"
"4752674","NA"
"1306151","NA"
"1285164","NA"
"2861235","NA"
"2102714","NA"
"1203473","Collaborative Research: Eurasian and Makarov basins observational network targets changes in the Arctic Ocean"
"1503928","Collaborative Research: Visualization, analysis, and HPC modeling of subglacial hydrology from high-resolution 3D conduit scans acquired with a novel sensor"
"1203838","Collaborative Research:  P2C2--Reconstructing Central Alaskan Precipitation Variability and Atmospheric Circulation during the Past Millennium"
"1534673","The Second Polar Data Forum: Understanding the Polar Regions through Globally Collaborative Data Management"
"1023396","Effects of Environmental Change on Arctic-Breeding Shorebirds"
"0732885","IPY Back to the Future (BTF): Re-sampling old research sites to assess change in high latitude terrestrial ecosystem structure and function"
"6748074","NA"
"1267200","NA"
"1131520","NA"
"2145792","NA"
"6193507","NA"
"7951411","NA"
"1263005","Collaborative Research: REU Site: Svalbard REU: Holocene and Modern Climate Change in the Norwegian High Arctic"
"1262871","Collaborative Research: REU Site: Svalbard REU: Holocene and Modern Climate Change in the Norwegian High Arctic"
"1023191","Deciphering 6 My of the Greenland Ice Sheet History using in situ 10-Be from marine sediment cores"
"1014553","NA"
"1031063","NA"
"1133585","NA"
"1092241","NA"
"1034097","NA"
"1083645","NA"
"1126875","NA"
"1147337","SI2-SSE Collaborative Research: SPIKE-An Implementation of a Recursive Divide-and-Conquer Parallel Strategy for Solving Large Systems of Linear Equations"
"1111244","NA"
"1009097","NA"
"1048949","NA"
"1036776","NA"
"1118664","Collaborative Research: ScratchJr: Computer Programming in Early Childhood Education as a Pathway to Academic Readiness and Success"
"1096509","NA"
"1062170","Genome Structure and Variation Workshop to be held in the summer 2011 at Rutgers Center for Discrete Mathematics and Theoretical Computer Science (DIMACS)."
"1147812","EAGER: Self-Repairable Glass-Ceramic Composites for Solid Oxide Fuel Cells"
"1183451","NA"
"1086915","NA"
"1034680","NA"
"1003080","Interacting Two Dimensional Electron Systems"
"1002555","NA"
"1699167","NA"
"0163212","NA"
"2639796","NA"
"4094198","NA"
"1452779","Graduate Research Fellowship Program (GRFP)"
"4895374","NA"
"1338380","NA"
"3796411","NA"
"1058432","Partnership for Expanding ""Exploring Computer Science"" (PEECS)"
"4015380","NA"
"1359833","NA"
"0856330","Collaborative Research: Sustained Observations of the North Pole Environment to Characterize Ongoing Arctic Change"
"1022475","Collaborative Research:  Long-term Observations in the Switchyard Region of the Arctic Ocean as part of the Arctic Observing Network (AON)"
"1304052","Collaborative Research:  A Bering Strait Ocean Observing System for the Pacific Inflow to the Arctic- a fundamental part of the Arctic Observing Network"
"1203262","Collaborative Research:  Seasonal Synergy between Bacterial Osmoprotection and Algal Production in Sea Ice"
"1203267","Collaborative Research: Seasonal Synergy between Bacterial Osmoprotection and Algal Production in Sea Ice"
"1758729","NA"
"2897234","NA"
"4625365","NA"
"1417789","Mapping and Quantifying Methane Seeps on the Eastern Siberian Shelf and Slope -- A Component of the Swedish Russian U.S. Climate-Cryosphere-Carbon Interactions (SWERUS-C3) Program"
"3977770","NA"
"1022472","The Arctic Observing Network at Critical Gateways--A Sustained Observing System at Davis Strait"
"1263854","Cumulative Effects of Arctic Oil Development - planning and designing for sustainability"
"0732726","Collaborative Research: IPY:  Dynamic Controls on Tidewater Glacier Retreat"
"1204223","NEEM basal ice, assessing the attributes of a cold, deep, dark ecosystem"
"0909372","Impacts of Climate Change and Ice Conditions on Microbial Food Web Dynamics in the Barents Sea"
"0519840","Student-PARTNERS:  A Pan-Arctic Science and Education Collaboration"
"1932825","NA"
"5516156","NA"
"1107593","Collaborative Research on Carbon, Water, and Energy Balance of the Arctic Landscape  at Flagship Observatories in Alaska and Siberia"
"1107707","Collaborative Research on Carbon, Water, and Energy Balance of the Arctic Landscape  at Flagship Observatories in Alaska and Siberia"
"1546002","Collaborative research: Spatial and temporal variability of surface albedo and light absorbing chemical species in Greenland."
"2588701","NA"
"0856177","UpTempO: Measuring the Upper Layer Temperature of the Arctic Ocean"
"1203506","UpTempO:  Measuring the Upper Layer Temperature of the Arctic Ocean"
"1865279","NA"
"1023270","Collaborative Research: Turning on the lights - Photochemical and microbial processing of newly exposed carbon in arctic ecosystems"
"1351745","CAREER:   The Role of Iron and Reactive Oxygen Species in the Oxidation and Fate of DOM in Natural Waters"
"4463104","NA"
"8659968","NA"
"1642016","Collaborative Research:   The Ends of Oil: Changing Life in Earth Science, Extractive Industry, and Indigenous Communities in Alaska"
"1108074","Modeling and Isotopes Link Mycorrhizal Fungi to Soil Carbon and Organic Nitrogen Use"
"1023334","Population genetics of a climate-indicating predator across the forest-tundra ecotone"
"1504521","Collaborative Research: Impact of subglacial discharge on turbulent plume dynamics and ocean-glacier heat and mass transfer"
"1504288","Collaborative Research: Impact of subglacial discharge on turbulent plume dynamics and ocean-glacier heat and mass transfer"
"2206762","NA"
"4311405","NA"
"3364144","NA"
"0713943","Collaborative Research:  A Synthesis of Existing and New Observations of Air-Snowpack Exchanges to Assess the Arctic"
"1127959","NA"
"1283029","NA"
